{
  "experiment_id": "e39ebc453f33f545dba81cade85d9241717add95c15765ec1b1d5818416198f3",
  "device_id": "mac_mini_m4_16gb",
  "status": "completed",
  "error_message": null,
  "started_at": "2026-06-11T21:23:57.896957Z",
  "completed_at": "2026-06-11T21:40:38.713928Z",
  "hardware_fingerprint": {
    "os_version": "macOS 26.5.1",
    "available_ram_mb": 1662.9375,
    "thermal_state": null,
    "swap_used_mb": 18316.9375
  },
  "ttft_ms": null,
  "decode_tokens_per_sec": null,
  "peak_memory_mb": null,
  "on_disk_size_mb": null,
  "energy_j": null,
  "quality_scores": [
    {
      "benchmark": "RealWorldQA",
      "metric": "Overall",
      "value": 0.65
    }
  ]
}