{
  "experiment_id": "8190916170afe2275809dc3510b7ab7774843edd0649937584bcdf23eca1d3bb",
  "device_id": "mac_mini_m4_16gb",
  "status": "completed",
  "error_message": null,
  "started_at": "2026-06-12T00:44:32.451763Z",
  "completed_at": "2026-06-12T00:46:33.557892Z",
  "hardware_fingerprint": {
    "os_version": "macOS 26.5.1",
    "available_ram_mb": 1015.765625,
    "thermal_state": null,
    "swap_used_mb": 9421.6875
  },
  "ttft_ms": null,
  "decode_tokens_per_sec": null,
  "peak_memory_mb": null,
  "on_disk_size_mb": null,
  "energy_j": null,
  "quality_scores": [
    {
      "benchmark": "MMBench_DEV_EN",
      "metric": "Overall",
      "value": 0.66
    },
    {
      "benchmark": "MMBench_DEV_EN",
      "metric": "AR",
      "value": 0.6764705882352942
    },
    {
      "benchmark": "MMBench_DEV_EN",
      "metric": "CP",
      "value": 0.6944444444444444
    },
    {
      "benchmark": "MMBench_DEV_EN",
      "metric": "FP-C",
      "value": 0.5
    },
    {
      "benchmark": "MMBench_DEV_EN",
      "metric": "FP-S",
      "value": 0.5625
    },
    {
      "benchmark": "MMBench_DEV_EN",
      "metric": "LR",
      "value": 0.6666666666666666
    },
    {
      "benchmark": "MMBench_DEV_EN",
      "metric": "action_recognition",
      "value": 1.0
    },
    {
      "benchmark": "MMBench_DEV_EN",
      "metric": "attribute_recognition",
      "value": 0.6666666666666666
    },
    {
      "benchmark": "MMBench_DEV_EN",
      "metric": "function_reasoning",
      "value": 0.8333333333333334
    },
    {
      "benchmark": "MMBench_DEV_EN",
      "metric": "future_prediction",
      "value": 1.0
    },
    {
      "benchmark": "MMBench_DEV_EN",
      "metric": "identity_reasoning",
      "value": 0.5
    },
    {
      "benchmark": "MMBench_DEV_EN",
      "metric": "image_quality",
      "value": 0.6451612903225806
    },
    {
      "benchmark": "MMBench_DEV_EN",
      "metric": "image_scene",
      "value": 1.0
    },
    {
      "benchmark": "MMBench_DEV_EN",
      "metric": "object_localization",
      "value": 0.25
    },
    {
      "benchmark": "MMBench_DEV_EN",
      "metric": "physical_property_reasoning",
      "value": 0.6538461538461539
    },
    {
      "benchmark": "MMBench_DEV_EN",
      "metric": "spatial_relationship",
      "value": 0.0
    },
    {
      "benchmark": "MMBench_DEV_EN",
      "metric": "structuralized_imagetext_understanding",
      "value": 0.6363636363636364
    }
  ]
}