{
  "experiment_id": "e3adc60b76b266502fc78e95829f0850f059323a1b2d183a67fb10a982eadf20",
  "device_id": "raspberry_pi_5_4gb",
  "status": "completed",
  "error_message": null,
  "started_at": "2026-05-20T10:00:00+00:00",
  "completed_at": "2026-05-20T10:04:32+00:00",
  "hardware_fingerprint": {
    "os_version": "Raspbian GNU/Linux 12 (bookworm)",
    "available_ram_mb": 2048.0,
    "thermal_state": "normal",
    "swap_used_mb": 0.0
  },
  "ttft_ms": 4200.0,
  "decode_tokens_per_sec": 2.8,
  "peak_memory_mb": 1820.0,
  "on_disk_size_mb": 287.0,
  "energy_j": null,
  "quality_scores": [
    {"benchmark": "stage_a_vqa", "metric": "accuracy", "value": 0.61},
    {"benchmark": "POPE", "metric": "accuracy", "value": 0.83}
  ]
}
