{
  "experiment_id": "94e83a97424a48489fa73ed585191973509ccb5e96982d800cdb9eadb0490466",
  "device_id": "mac_mini_m4_16gb",
  "status": "completed",
  "error_message": null,
  "started_at": "2026-05-20T23:05:11.267128Z",
  "completed_at": "2026-05-20T23:06:24.350031Z",
  "hardware_fingerprint": {
    "os_version": "macOS 26.5",
    "available_ram_mb": 2372.984375,
    "thermal_state": null,
    "swap_used_mb": 1538.0625
  },
  "ttft_ms": 1402.1093329938594,
  "decode_tokens_per_sec": 11.054455104692854,
  "peak_memory_mb": 7956.859375,
  "on_disk_size_mb": 7172.481986999512,
  "energy_j": null,
  "quality_scores": []
}