{
  "experiment_id": "a1b2c3d4e5f6a1b2c3d4e5f6a1b2c3d4e5f6a1b2c3d4e5f6a1b2c3d4e5f6a1b2",
  "device_id": "raspberry_pi_5_4gb",
  "status": "oom",
  "error_message": "Process killed by OOM killer at model load; /proc/meminfo showed 31 MB free before kill signal",
  "started_at": "2026-05-20T11:00:00+00:00",
  "completed_at": "2026-05-20T11:00:47+00:00",
  "hardware_fingerprint": {
    "os_version": "Raspbian GNU/Linux 12 (bookworm)",
    "available_ram_mb": 312.0,
    "thermal_state": "normal",
    "swap_used_mb": 0.0
  },
  "ttft_ms": null,
  "decode_tokens_per_sec": null,
  "peak_memory_mb": null,
  "on_disk_size_mb": null,
  "energy_j": null,
  "quality_scores": []
}
